{
  "$schema": "https://json-schema.org/draft/2020-12/schema",
  "$id": "https://autocode.example/schema/runtime/v1/service_runtime_descriptor.v1.schema.json",
  "title": "ServiceRuntimeDescriptor v1",
  "type": "object",
  "additionalProperties": false,
  "required": ["schemaVersion", "serviceId"],
  "properties": {
    "schemaVersion": { "type": "integer", "const": 1 },
    "serviceId": { "type": "string", "minLength": 1 },
    "displayName": { "type": "string" },
    "ports": {
      "type": "array",
      "items": {
        "type": "object",
        "additionalProperties": false,
        "required": ["port"],
        "properties": {
          "name": { "type": "string" },
          "port": { "type": "integer", "minimum": 1, "maximum": 65535 },
          "protocol": { "type": "string" }
        }
      }
    },
    "healthCheck": {
      "type": "object",
      "additionalProperties": false,
      "required": ["path"],
      "properties": {
        "path": { "type": "string", "minLength": 1 },
        "method": { "type": "string" },
        "portName": { "type": "string" }
      }
    },
    "environment": {
      "type": "array",
      "items": {
        "type": "object",
        "additionalProperties": false,
        "required": ["name"],
        "properties": {
          "name": { "type": "string", "minLength": 1 },
          "description": { "type": "string" },
          "required": { "type": "boolean" },
          "defaultValue": { "type": "string" }
        }
      }
    },
    "startup": {
      "type": "object",
      "additionalProperties": false,
      "required": ["command"],
      "properties": {
        "command": { "type": "string", "minLength": 1 },
        "workingDir": { "type": "string" },
        "args": {
          "type": "array",
          "items": { "type": "string" }
        }
      }
    }
  }
}
